number,question,mapping1_url,mapping1_label,mapping2_url,mapping2_label,mapping3_url,mapping3_label,mapping4_url,mapping4_label
1,"In the past 7 days, I felt angry when I had pain",https://hpo.jax.org/app/browse/term/HP:0012531,pain,https://hpo.jax.org/app/browse/term/HP:0100851,Abnormal emotion/affect behavior,http://purl.bioontology.org/ontology/LNC/62142-5,I felt angry when I had pain in past 7 days [PROMIS],http://purl.obolibrary.org/obo/NCIT_C119959,Felt angry when in pain
2,"In the past 7 days, I had trouble doing schoolwork when I had pain",https://hpo.jax.org/app/browse/term/HP:0012531,pain,https://hpo.jax.org/app/browse/term/HP:0031058,Impairment of activities of daily living,http://purl.bioontology.org/ontology/LNC/62143-3,I had trouble doing schoolwork when I had pain in past 7 days [PROMIS],http://ncicb.nci.nih.gov/xml/owl/EVS/Thesaurus.owl#C119960,Trouble Doing Schoolwork When in Pain
3,"In the past 7 days, I had trouble sleeping when I had pain",https://hpo.jax.org/app/browse/term/HP:0012531,pain,https://hpo.jax.org/app/browse/term/HP:0100785,Insomnia,http://purl.bioontology.org/ontology/LNC/62144-1,I had trouble sleeping when I had pain in past 7 days [PROMIS],http://ncicb.nci.nih.gov/xml/owl/EVS/Thesaurus.owl#C119958,Trouble Sleeping When in Pain
4,"In the past 7 days, it was hard for me to pay attention when I had pain",https://hpo.jax.org/app/browse/term/HP:0012531,pain,https://hpo.jax.org/app/browse/term/HP:0000736,Short attention span,http://purl.bioontology.org/ontology/LNC/62154-0,It was hard for me to pay attention when I had pain in past 7 days [PROMIS],http://ncicb.nci.nih.gov/xml/owl/EVS/Thesaurus.owl#C119961,Hard to Pay Attention When in Pain
5,"In the past 7 days, it was hard for me to run when I had pain",https://hpo.jax.org/app/browse/term/HP:0012531,pain,https://hpo.jax.org/app/browse/term/HP:0009046,Difficulty running,http://purl.bioontology.org/ontology/LNC/62148-2,It was hard for me to run when I had pain in past 7 days [PROMIS],http://ncicb.nci.nih.gov/xml/owl/EVS/Thesaurus.owl#C119962,Hard to Run When in Pain
6,"In the past 7 days, it was hard for me to walk one block when I had pain",https://hpo.jax.org/app/browse/term/HP:0012531,pain,https://hpo.jax.org/app/browse/term/HP:0002355,Difficulty walking,http://purl.bioontology.org/ontology/LNC/62149-0,It was hard for me to walk one block when I had pain in past 7 days [PROMIS],http://ncicb.nci.nih.gov/xml/owl/EVS/Thesaurus.owl#C119963,Hard to Walk One Block When in Pain
7,"In the past 7 days, it was hard to have fun when I had pain",https://hpo.jax.org/app/browse/term/HP:0012531,pain,https://hpo.jax.org/app/browse/term/HP:0000716,Depressivity,http://purl.bioontology.org/ontology/LNC/62152-4,It was hard to have fun when I had pain in past 7 days [PROMIS],http://ncicb.nci.nih.gov/xml/owl/EVS/Thesaurus.owl#C119964,Hard to Have Fun When in Pain
8,"In the past 7 days, it was hard to stay standing when I had pain",https://hpo.jax.org/app/browse/term/HP:0012531,pain,https://hpo.jax.org/app/browse/term/HP:0003698,Difficulty standing,http://purl.bioontology.org/ontology/LNC/62153-2,It was hard to stay standing when I had pain in past 7 days [PROMIS],http://ncicb.nci.nih.gov/xml/owl/EVS/Thesaurus.owl#C119965,Hard to Stay Standing When in Pain