number,question,mapping1_url,mapping1_label,mapping2_url,mapping2_label
1,"In the past 7 days, I felt accepted by other kids my age",https://hpo.jax.org/app/browse/term/HP:0000735,Impaired social interactions,http://purl.bioontology.org/ontology/LNC/62156-5,I felt accepted by other kids my age in past 7 days [PROMIS]
2,"In the past 7 days, I was able to count on my friends",https://hpo.jax.org/app/browse/term/HP:0000735,Impaired social interactions,http://purl.bioontology.org/ontology/LNC/62163-1,I was able to count on my friends in past 7 days [PROMIS]
3,"In the past 7 days, I was able to talk about everything with my friends",https://hpo.jax.org/app/browse/term/HP:0000735,Impaired social interactions,http://purl.bioontology.org/ontology/LNC/62165-6,I was able to talk about everything with my friends in past 7 days [PROMIS]
4,"In the past 7 days, I was good at making friends",https://hpo.jax.org/app/browse/term/HP:0000735,Impaired social interactions,http://purl.bioontology.org/ontology/LNC/62166-4,I was good at making friends in past 7 days [PROMIS]
5,"In the past 7 days, my friends and I helped each other out",https://hpo.jax.org/app/browse/term/HP:0000735,Impaired social interactions,http://purl.bioontology.org/ontology/LNC/62167-2,My friends and I helped each other out in past 7 days [PROMIS]
6,"In the past 7 days, other kids wanted to be my friend",https://hpo.jax.org/app/browse/term/HP:0000735,Impaired social interactions,http://purl.bioontology.org/ontology/LNC/62168-0,Other kids wanted to be my friend in past 7 days [PROMIS]
7,"In the past 7 days, other kids wanted to be with me",https://hpo.jax.org/app/browse/term/HP:0000735,Impaired social interactions,http://purl.bioontology.org/ontology/LNC/62169-8,Other kids wanted to be with me in past 7 days [PROMIS]
8,"In the past 7 days, other kids wanted to talk to me",https://hpo.jax.org/app/browse/term/HP:0000735,Impaired social interactions,http://purl.bioontology.org/ontology/LNC/62170-6,Other kids wanted to talk to me in past 7 days [PROMIS]