number,question,mapping1_url,mapping1_label,mapping2_url,mapping2_label
1,"In the past 7 days, my child could do sports and exercise that other kids his/her age could do",https://hpo.jax.org/app/browse/term/HP:0004302,Functional motor deficit,http://purl.bioontology.org/ontology/LNC/90683-4,My child could do sports and exercise that other kids his/her age could do in past 7 days [PROMIS.PARENTPROXY]
2,"In the past 7 days, my child could get up from the floor",https://hpo.jax.org/app/browse/term/HP:0004302,Functional motor deficit,http://purl.bioontology.org/ontology/LNC/90696-6,My child could get up from the floor in past 7 days [PROMIS.PARENTPROXY]
3,"In the past 7 days, my child could keep up when he/she played with other kids",https://hpo.jax.org/app/browse/term/HP:0004302,Functional motor deficit,http://purl.bioontology.org/ontology/LNC/90700-6,My child could keep up when he/she played with other kids in past 7 days [PROMIS.PARENTPROXY]
4,"In the past 7 days, my child could move his/her legs",https://hpo.jax.org/app/browse/term/HP:0004302,Functional motor deficit,http://purl.bioontology.org/ontology/LNC/90695-8,My child could move his/her legs in past 7 days [PROMIS.PARENTPROXY]
5,"In the past 7 days, my child could stand up without help",https://hpo.jax.org/app/browse/term/HP:0004302,Functional motor deficit,http://purl.bioontology.org/ontology/LNC/90693-3,My child could stand up without help in past 7 days [PROMIS.PARENTPROXY]
6,"In the past 7 days, my child could stand up on his/her tiptoes",https://hpo.jax.org/app/browse/term/HP:0004302,Functional motor deficit,http://purl.bioontology.org/ontology/LNC/90689-1,My child could stand up on his/her tiptoes in past 7 days [PROMIS.PARENTPROXY]
7,"In the past 7 days, my child could walk up stairs without holding on to anything",https://hpo.jax.org/app/browse/term/HP:0004302,Functional motor deficit,http://purl.bioontology.org/ontology/LNC/90687-5,My child could walk up stairs without holding on to anything in past 7 days [PROMIS.PARENTPROXY]
8,"In the past 7 days, my child has been physically able to do the activities he/she enjoys the most",https://hpo.jax.org/app/browse/term/HP:0004302,Functional motor deficit,http://purl.bioontology.org/ontology/LNC/90681-8,My child has been physically able to do the activities he/she enjoys the most in past 7 days [PROMIS.PARENTPROXY]