number,question,mapping1_url,mapping1_label,mapping2_url,mapping2_label
1,"In the past 7 days, my child felt accepted by other kids his/her age",https://hpo.jax.org/app/browse/term/HP:0000735,Impaired social interactions,http://purl.bioontology.org/ontology/LNC/90672-7,My child felt accepted by other kids his/her age in past 7 days [PROMIS.PARENTPROXY]
2,"In the past 7 days, my child was able to count on his/her friends",https://hpo.jax.org/app/browse/term/HP:0000735,Impaired social interactions,http://purl.bioontology.org/ontology/LNC/90675-0,My child was able to count on his/her friends in past 7 days [PROMIS.PARENTPROXY]
3,"In the past 7 days, my child was good at making friends",https://hpo.jax.org/app/browse/term/HP:0000735,Impaired social interactions,http://purl.bioontology.org/ontology/LNC/90671-9,My child was good at making friends in past 7 days [PROMIS.PARENTPROXY]
4,"In the past 7 days, my child and his/her friends helped each other out",https://hpo.jax.org/app/browse/term/HP:0000735,Impaired social interactions,http://purl.bioontology.org/ontology/LNC/90670-1,My child and his/her friends helped each other out in past 7 days [PROMIS.PARENTPROXY]
5,"In the past 7 days, other kids wanted to be my child's friend",https://hpo.jax.org/app/browse/term/HP:0000735,Impaired social interactions,http://purl.bioontology.org/ontology/LNC/90664-4,Other kids wanted to be my child's friend in past 7 days [PROMIS.PARENTPROXY]
6,"In the past 7 days, other kids wanted to be with my child ",https://hpo.jax.org/app/browse/term/HP:0000735,Impaired social interactions,http://purl.bioontology.org/ontology/LNC/90673-5,Other kids wanted to be with my child in past 7 days [PROMIS.PARENTPROXY]
7,"In the past 7 days, other kids wanted to talk to my child ",https://hpo.jax.org/app/browse/term/HP:0000735,Impaired social interactions,http://purl.bioontology.org/ontology/LNC/90669-3,Other kids wanted to talk to my child in past 7 days [PROMIS.PARENTPROXY]